{
  "schema_version": "1.0",
  "updated_at": "2026-07-11T06:36:12+00:00",
  "active_data_manifest_id": null,
  "repairs": [
    {
      "evidence_id": "barcode-repair-20260711-d626ad8-v003",
      "data_manifest_id": "barcode-repair-20260711-d626ad8-v003:1204018178a4d355",
      "status": "verified_pending_gate_release",
      "evidence_commit": "f947999fb1c0e0dbf5e99a363744ac32305e4892",
      "evidence_path": "automation/evidence/barcode-repair-20260711-d626ad8-v003",
      "source_commit": "d626ad887838cbda342507926e6cf9189df8a515",
      "audit_sha256": "1204018178a4d355c2aa03314d0fafa9f0151457b9edcef3a0df9b5946c306e2",
      "server_stage_path": "D:\\AIPatho\\Patch\\mpp_zscore_repair_staging\\barcode-repair-20260711-d626ad8-v003",
      "generated_asset_count": 80,
      "source_asset_count": 36,
      "label_asset_count": 65,
      "imported_at": "2026-07-11T06:36:12+00:00"
    }
  ]
}
